{
  "id": "light-on-two-sides",
  "name": "Light on Two Sides of Every Room",
  "source_work": "A Pattern Language",
  "paraphrase": "Locate each room so that it has outdoor space outside it on at least two sides, and place windows in those outdoor walls so that natural light enters from more than one direction. Alexander observes that when people are free to choose, they consistently gravitate toward rooms lit from two sides and abandon rooms lit from only one; rooms with cross-light have less glare, faces and gestures read more clearly, and the social atmosphere is markedly better.",
  "verified_against_corpus": true,
  "canonical_reference": {
    "pages": "746-751",
    "edition": "Oxford University Press 1977",
    "isbn": "0-19-501919-9"
  },
  "geometric_operationalisation": {
    "metric_name": "light_two_sides_ratio"
  },
  "skills_embodying": [
    "kitchen",
    "bedroom",
    "living_room",
    "dining_room",
    "study"
  ]
}
