{
  "id": "sleeping-to-the-east",
  "name": "Sleeping to the East",
  "source_work": "A Pattern Language",
  "paraphrase": "Orient bedrooms so the morning sun can reach the sleepers, placing the bed where the first eastern light enters the room. Alexander observes that people wake more naturally and feel better when daylight, not an alarm, lifts them out of sleep, so the eastern side of the house should be reserved for bedrooms and the bed itself positioned to catch that early light.",
  "verified_against_corpus": true,
  "canonical_reference": {
    "pages": "656-659",
    "edition": "Oxford University Press 1977",
    "isbn": "0-19-501919-9"
  },
  "skills_embodying": [
    "bedroom",
    "nursery"
  ]
}
