{
  "id": "workspace-privacy",
  "name": "Half-Private Office",
  "source_work": "A Pattern Language",
  "paraphrase": "Avoid both closed, separate, fully private offices and fully open-plan offices; make every workroom, whether for one person or a small group, half-open to the other workgroups and the world immediately beyond it. Place a comfortable sitting area just inside the door for visitors and informal exchange, and keep the actual workspaces further back, so people can concentrate while still sensing the life of the surrounding office.",
  "verified_against_corpus": true,
  "canonical_reference": {
    "pages": "717-720",
    "edition": "Oxford University Press 1977",
    "isbn": "0-19-501919-9"
  },
  "geometric_operationalisation": {
    "metric_name": "office_half_open_ratio",
    "expected_range": [0.5, 0.75]
  },
  "skills_embodying": [
    "study",
    "library"
  ]
}
