{
  "id": "garden-growing-wild",
  "name": "Garden Growing Wild",
  "source_work": "A Pattern Language",
  "paraphrase": "Resist the temptation to manicure the garden into a formal, tidy arrangement; instead, let it grow half-wild, with self-seeded plants, native species and a tangle of growth that follows natural processes rather than rigid design. Alexander argues that an overly groomed garden is dead to the senses, while a garden allowed its own life invites birds, insects and quiet wonder, becoming a place where people actually want to spend time.",
  "verified_against_corpus": true,
  "canonical_reference": {
    "pages": "801-803",
    "edition": "Oxford University Press 1977",
    "isbn": "0-19-501919-9"
  },
  "geometric_operationalisation": {
    "metric_name": "garden_wildness_ratio"
  },
  "skills_embodying": [
    "garden_bed",
    "courtyard_indoor",
    "pergola"
  ]
}
